"Story","Title","Result","Date","Stability","Duration (s)"
"Register mentor","Register mentor valid json","SUCCESS","2023-04-04T09:48:19.796+07:00[Asia/Bangkok]","0.0","1.88"
"Register mentor","Register mentor with invalid json","SUCCESS","2023-04-04T09:48:22.206+07:00[Asia/Bangkok]","0.0","0.57"
"Register mentor","Register mentor with blank json","SUCCESS","2023-04-04T09:48:22.787+07:00[Asia/Bangkok]","0.0","0.37"
"Register student","Register student invalid data","SUCCESS","2023-04-04T09:48:24.253+07:00[Asia/Bangkok]","0.0","1.7"
"Register student","Register student blank data","SUCCESS","2023-04-04T09:48:25.965+07:00[Asia/Bangkok]","0.0","0.35"
